### ISSUE TITLE
On a plain ESP32 the delivery channel's TLS session cannot be set up at all

### ISSUE THREAD

**Issue by mairas** [SensESP/BLE-gateway#22]
Measured on an ESP32 (HALMET) running the native-BLE gateway against a TLS Signal K
endpoint, Bluedroid scanning, `enable_control_ws = false`, so the only two TLS users
are `SKWSClient`'s delta socket and the gateway's advertisement POST client.

The POST client never gets a TLS session:

```
E esp-tls-mbedtls: Failed to set client configurations, returned [0x8017] (ESP_ERR_MBEDTLS_SSL_SETUP_FAILED)
E esp-tls: create_ssl_handle failed
W ble_gw: POST failed: ESP_ERR_HTTP_CONNECT, heap=34084
```

This is `create_ssl_handle` failing at setup, before any handshake and before any
certificate work — not the fragmented-heap reconnect failure that
https://github.com/SensESP/BLE-gateway/issues/3 was about. Free heap sits at
33–34 kB for the whole run and every post interval fails identically. Over 110 s:
`post_ok=0`, `post_fail=8`, `gw_dropped=1785`. The same firmware against the same
server over plaintext forwards normally at ~0.4 POSTs/s.

The arithmetic is unsurprising once written down. `CONFIG_MBEDTLS_SSL_IN_CONTENT_LEN`
is pinned at 16384 (deliberately — see
https://github.com/SensESP/BLE-gateway/pull/6), Bluedroid and WiFi take their share,
and the delta socket already holds one session's buffers. A second session does not
fit in what is left on a 4 MB no-PSRAM ESP32.

Worth deciding what the library should do about it, because right now the failure
mode is silent in the sense that matters: the gateway looks healthy, scans happily,
counts advertisements, and drops every one of them.

Options, none obviously right:

- Share one TLS session between the delta socket and the POST channel. Largest win,
  largest change, and `SKWSClient` does not currently expose anything to share.
- Detect at startup that a second session will not fit and say so once at error
  level, rather than failing every interval forever.
- Document plain ESP32 as plaintext-only for the delivery channel and let the
  marine variants that need TLS use an S3 or a chip with PSRAM.

The C3 example already disables the control WebSocket for a related reason, so
there is precedent for treating this as a per-chip capability question rather than
something to fix in the allocator.

**Comment by mairas** [comment]
Re-measured on current main (post-#25), same board, 145 s runs, with the heartbeat extended to log `heap_caps_get_largest_free_block(MALLOC_CAP_INTERNAL | MALLOC_CAP_8BIT)` as `lfb`.

The failure still reproduces, and it is blunter than this issue records. It is not `create_ssl_handle` any more — the POST client never gets that far.

Plaintext, for reference:

| stage | free heap | largest block |
|---|---|---|
| WiFi up, delta socket down, no scan | 73.0-78.6 kB | 38912 B |
| delta socket up, scanning | 53.9-64.4 kB | 15360-28672 B |

TLS, same firmware, `ssl_enabled = true` against a CA-anchored Signal K TLS endpoint:

| stage | free heap | largest block |
|---|---|---|
| WiFi up, delta socket down, no scan | 70.2-76.2 kB | 29696 B |
| delta socket up over TLS | 36.4 kB | 2304 B |
| scanning added | 36.4 kB | 2304 B, flat for 130 s |

Bringing up one TLS session costs about 40 kB of free heap and takes the largest contiguous block from 29696 B to 2304 B. After that:

```
E websocket_client: Error create websocket task
E HTTP_CLIENT: Allocation failed
W ble_gw: esp_http_client_init failed
```

once a second for the whole run. `post_ok=0` and `ws_up=0` throughout, and 2888 of 2888 advertisements dropped, because `min_largest_free_block` is 8192 and the largest block is 2304.

Two corrections to the record while I am here. The "largest free block sits at 8192" figure quoted in #24 belonged to `max_pending_ads = 500`; on current main with the default of 50 it is 15-28 kB while scanning. And the buffer fixes in #25 did not change this outcome — a single TLS session is what exhausts the contiguous memory, not the advertisement buffer.

Method, for repeatability: set `sk_port` and `ssl_enabled` through `PUT /api/config/System/Signal K Settings`, then `POST /api/device/restart`. Note that once the board is in this state the PUT itself fails — the handler allocates a contiguous buffer the size of the payload, about 2.5 kB, and there is no such block. Restoring the configuration has to be done in the boot window before the delta socket connects.

**Comment by mairas** [comment]
Correcting my previous comment, which attributed the collapse to TLS in general. That was incomplete and, read on its own, misleading.

Two production SensESP devices on the same Signal K server, over TLS on the same port, report 71140 B free with a 36864 B largest block, and 107708 B free with a 65536 B largest block. Neither runs the Bluetooth stack, and both set `CONFIG_MBEDTLS_DYNAMIC_BUFFER=y`. TLS on its own is affordable.

So I tested the other side of our own pin. Same code as main, one variable changed:

| build | TLS | largest block, delta socket up | control WS | POST | outcome |
|---|---|---|---|---|---|
| main, `DYNAMIC_BUFFER=n` | off | 15-29 kB | connects | works | delivers |
| main, `DYNAMIC_BUFFER=n` | on | 2304 B | never | never initialises | 2888/2888 dropped, no reboots |
| `DYNAMIC_BUFFER=y` | on | 7-12 kB | connects | fails | all dropped, 5 reboots in 150 s |

With dynamic buffers on, the failure is exactly the one #3 recorded and that this pin exists to prevent:

```
19 x Dynamic Impl: alloc(4437 bytes) failed
12 x Dynamic Impl: alloc(4770 bytes) failed
 3 x esp-tls-mbedtls: write error :-0x7F00
 8 x ESP_ERR_MBEDTLS_SSL_HANDSHAKE_FAILED
28 x POST failed: ESP_ERR_HTTP_CONNECT
 5 x rst:0xc (SW_CPU_RESET)
```

I had assumed the pin was stale, on the grounds that #3's heap pressure came from the 500-entry buffer removed in #25. It is not stale. At the 50-entry default the per-call record buffer still competes with advertisement churn and still fails.

The conclusion is stronger than this issue currently states, and it is not about TLS setup specifically. The gateway cannot deliver over TLS on a plain ESP32 in either mbedTLS buffer mode. Static buffers leave no block big enough to construct anything else. Dynamic buffers let the second session up and lose the third, with reboots. One TLS session is what this device affords, and the protocol wants two more.

**Comment by mairas** [comment]
Completing the matrix. My last comment varied `CONFIG_MBEDTLS_DYNAMIC_BUFFER` only. The other mbedTLS lever is `CONFIG_MBEDTLS_SSL_IN_CONTENT_LEN`, and 8192 is what production SensESP devices run against the same server, so it was the obvious thing to try. Four builds, same code as main, same board, TLS on, 150 s each. `lfb` is the largest free block once the delta socket is up.

| `DYNAMIC_BUFFER` | `IN_CONTENT_LEN` | heap | lfb | control WS | post_ok | reboots |
|---|---|---|---|---|---|---|
| n | 16384 (main) | 36.4 kB | 2304 | never | 0 | 0 |
| y | 16384 | 51-54 kB | 7-12 kB | connects | 0 | 5 |
| n | 8192 | 35.8-38.2 kB | 2048-3072 | never | 0 | 6 |
| y | 8192 | 52.7 kB | 7680 | never | 0 | 3 |

All four deliver nothing. Lowering the record buffer does not buy contiguous memory back — at 8192 the free heap lands within 2% of the 16384 row and the largest block stays in the same 2-3 kB band, because whatever the smaller buffer frees is immediately spent on the connection attempt that failed earlier without it.

It makes the failure worse. At 16384 the control WebSocket dies at task creation, `esp_http_client` returns `Allocation failed`, and the gateway stays up dropping advertisements. At 8192 the task is created, `mbedtls_ssl_setup` then returns `-0x7F00` (`ALLOC_FAILED`), and the device aborts about a second later — six reboots in 150 s. These builds compile without exceptions, so getting further into the allocation path is a downgrade, not progress.

Worth noting the interaction with our own admission guard: at `lfb = 7680` the default `min_largest_free_block = 8192` rejects every advertisement on its own, so even a working POST client would deliver nothing in the `y` rows.

The record-buffer question is settled in #27 and the comment that misjustified the pin is corrected in #28. Nothing here changes this issue's conclusion — one TLS session is what a plain ESP32 affords and the protocol wants three — but the two remaining "did you try tuning mbedTLS" answers are now measured rather than assumed.

**Comment by mairas** [comment]
Correcting the free-heap figures in this issue, including my own comments above. They are all inflated by about 31 kB.

`ESP.getFreeHeap()` is `heap_caps_get_free_size(MALLOC_CAP_INTERNAL)` with no `MALLOC_CAP_8BIT`, so it counts the ESP32's IRAM-only region, which is 32-bit-access-only and can never hold a buffer. Where the heartbeat said 50776 free, the per-region dump said 19016. Read every "free heap" number in this thread as roughly 31 kB lower.

The per-region dump is the useful picture. Internal 8-bit heap at steady state, TLS, delta socket up, scanning:

| region | size | free | largest free block | free blocks |
|---|---|---|---|---|
| 0x3ffaff10 | 240 | 4 | 0 | 0 |
| 0x3ffb2730 | 15448 | 4 | 0 | 0 |
| 0x3ffb6388 | 7288 | 4 | 0 | 0 |
| 0x3ffb9a20 | 16648 | 4 | 0 | 0 |
| 0x3ffe0440 | 15072 | 172 | 112 | 2 |
| 0x3ffccb90 | 78960 | 188 | 68 | 4 |
| 0x3ffe4350 | 113840 | 18712 | 8192 | 36 |
| totals | | 19016 | 8192 | |

Five of the seven regions are full to within a few hundred bytes. All the slack is in the 113840-byte region: 18712 free in 36 blocks, largest 8192, so about 10.5 kB is stranded in 35 small holes.

Two configuration results since the last comment, same board, same server.

**8192 input record with the control WebSocket disabled** — two sessions instead of three — takes the steady-state largest block from 2560 to **7680**, with zero reboots. It still fails: `mbedtls_ssl_setup` wants 8525 contiguous bytes. Roughly 850 short. Halving the output record to 2048 on top frees heap but leaves the block at 7680, so the output buffer is not coming from the binding region.

**Initialisation order between Bluedroid and SensESP is neutral.** Constructed first, Bluedroid takes 19 kB of heap and zero off the largest block — it lands entirely in the small regions. Constructed second, SensESP fills those and Bluedroid takes 28672 off the big one. Both orders converge on 77824, and the steady-state block was 6912 either way. Their combined demand exceeds the small regions, so whichever runs second carries the same surplus into the 111 kB region.

**The gateway's own start costs about 6 kB of the largest block.** Delta socket alone, gateway never started: 21452 free, block 12800. Starting the gateway takes it to 9648 and 6912, before any POST is attempted.

Nothing here changes the conclusion. One TLS session is what a plain ESP32 affords. But the shortfall is now a specific number against a specific allocation rather than a general shortage.

**Comment by mairas** [comment]
Retested on `main` at 34f5304, with `CONFIG_MBEDTLS_SSL_IN_CONTENT_LEN=8192` and `CONFIG_MBEDTLS_SSL_OUT_CONTENT_LEN=2048`, HALMET, `enable_control_ws = false`, 130 s capture. The reason to retest: #33 cut the standing element array from 50 to 24 entries and took the ArduinoJson document off the POST path, and the spike behind #27 had measured the shortfall at 813 bytes — the first session leaving 7680 contiguous where the second needed 8493. It looked close enough to be worth one run.

It still fails, and the failure has moved. It is no longer `mbedtls_ssl_setup` returning `ESP_ERR_MBEDTLS_SSL_SETUP_FAILED`; it is now the CA certificate parse running out of memory, 27 times in 130 s:

```
E esp-tls-mbedtls: mbedtls_x509_crt_parse of CA cert returned -0x2880
E esp-tls-mbedtls: Failed to set client configurations, returned [0x8015] (ESP_ERR_MBEDTLS_X509_CRT_PARSE_FAILED)
E esp-tls: create_ssl_handle failed
```

21 of the 27 are `-0x2880` (`MBEDTLS_ERR_X509_ALLOC_FAILED`) and 6 are `-0x1180` (`MBEDTLS_ERR_PEM_ALLOC_FAILED`). Both are allocation failures, not certificate problems.

The heap picture, with the corrected `usable_free_heap()` in the heartbeat so these are real 8-bit figures:

| uptime | free heap | largest block | state |
|---|---|---|---|
| 10 s | 45864 | 30720 | before any session |
| 15 s | 8720 | 2304 | delta socket up, 4 POSTs already failed |
| 25 s onward | 7564 falling to 6036 | 2048 | delta socket **down**, nothing recovers |

So the first session does not leave 7680 any more — it leaves 2304, and the run never gets it back. The gateway then loses the delta socket as well and drops every advertisement through the ingest memory guard: `gw_rx=1672, gw_posted=0, gw_dropped=1672 (mem=1672 buf=0 und=0)`, `ws_up=0`, `post_ok=0`.

Two things worth separating before anyone tries again:

The 813-byte figure is dead. Whatever holds ~37 kB between the 10 s and 15 s heartbeats and does not release it is the thing to find, and it is a larger effect than every allocation this repo has tuned so far. It may be the failed attempts themselves: a `create_ssl_handle` that fails partway may not free what it took, in which case each retry makes the next one worse, which is what the monotonic decline from 7564 to 6036 looks like.

Reconnecting re-parses the CA. The device config carries `tofu_ca_pem` and every connection attempt parses it, so the contiguous requirement recurs on every retry rather than being paid once at boot. Parsing it once and holding the parsed chain would remove that from the retry path.

The board has been restored to plaintext and forwards normally on the same firmware.

**Comment by mairas** [comment]
Correcting my own comment above. I wrote that "whatever holds ~37 kB between the 10 s and 15 s heartbeats" is the thing to find. Nothing unexplained holds it, and I should have checked the plaintext arm of the same firmware before saying so.

The same build, same boot sequence, plaintext, taken from the run that restored the board:

| uptime | free heap | largest block | scanning | delta socket |
|---|---|---|---|---|
| 10 s | 48500 | 40960 | no | down |
| 15 s | 28492 | 26624 | yes | up |

Plaintext consumes 20008 bytes across that same window. So the TLS run's 37144 is 20 kB of scan startup plus about 17 kB for the session — an ordinary per-session cost, not a leak. The 1.5 kB monotonic decline over the following 100 s may still be the failed retries not freeing what they took, but that is a small effect and it is not what blocks the second session.

What actually blocks it is the fragmentation, which the free-heap column hides. At 15 s the two runs differ by 17 kB of free heap and by **24 kB of largest block**: 26624 plaintext against 2304 with TLS. One session takes more contiguous space than it consumes, and the second session needs 8493 contiguous.

That leaves the CA-parse observation in the earlier comment standing on its own: every reconnect re-parses `tofu_ca_pem`, so the contiguous requirement recurs on each retry instead of being paid once.

**Comment by mairas** [comment]
Retracting both of my comments from earlier today. They were measured with **three** TLS sessions, not the two this issue was written about: `gw_cfg.enable_control_ws = false` in the native example sits inside `#ifdef CONFIG_IDF_TARGET_ESP32C3`, so on an ESP32 the control WebSocket stays enabled. Neither the heap table nor the CA-parse failures in those comments describe the configuration this issue measures.

Redone on `main` at 34f5304 with the control WS disabled unconditionally, `IN_CONTENT_LEN=8192`, HALMET, 130 s captures. Four runs, and they do not tell one story.

The good news first. With two sessions the first one no longer leaves 7680 contiguous. The heartbeat reports 11264 to 11776 for the rest of the run, and a probe placed immediately before `esp_http_client_perform()` reports 12288 to 15872 at the moment the second session is actually created. The buffer pair wants about 9800 bytes at `OUT_CONTENT_LEN=1024`. There is room, and #33's savings are part of why.

It fails anyway, and not always for the same reason. Across the runs: `mbedtls_ssl_setup returned -0x7F00` (`MBEDTLS_ERR_SSL_ALLOC_FAILED`) 190 times in one run and 10 in another; `Failed to open new connection in specified timeout` 9 times in a third. The timeout case is the informative one, because the probe brackets it:

```
W ble_gw: pre-perform: lfb=15872 body=147
W esp-tls: Failed to open new connection in specified timeout
W ble_gw: post-perform: lfb=15872
```

15872 bytes contiguous before, 15872 after, 3.9 s elapsed, and the client is configured with `cfg.timeout_ms = 3000`. That attempt did not run out of memory; it ran out of time. The delta socket, which does connect, is given `network_timeout_ms = 10000`.

Raising the POST timeout to 15000 did not help — it made the run worse. Free heap collapsed to 1744 bytes by 15 s and Bluedroid never started, so the scanner never ran at all. A failing attempt that holds its allocations five times longer starves what boots after it.

So the single-cause reading in the issue body — a second session does not fit — is not what the current code does. Memory pressure is real and near, contiguous space at the moment of the attempt is sometimes sufficient, the handshake sometimes does not finish in 3 s, and a longer timeout trades one failure for a worse one. Which of these dominates changes between runs of the same firmware.

The next step is instrumentation rather than another lever: a `heap_caps_print_heap_info()` dump taken at the failure rather than 5 s later in the heartbeat, and the mbedTLS error at the point of failure rather than the esp-tls wrapper's summary. Four single runs cannot separate three failure modes, and I should not have tried to read a trend out of them.

Spike branch with the control-WS change, the buffer sizes and the probe: `spike/tls-retest-after-33`. The board is back on stock `main` firmware over plaintext and forwards normally (`post_ok=14`, `gw_dropped=0`).

**Comment by mairas** [comment]
Instrumented the failure instead of pulling another lever, and it resolves into one cause. The three failure modes in my previous comment are one mechanism seen at different points.

## What the instrumentation shows

Timing and heap taken either side of the same `esp_http_client_perform()` call, plus a `heap_caps_print_heap_info()` dump at the failure. Control WS disabled, `IN_CONTENT_LEN=8192`, `OUT_CONTENT_LEN=1024`, HALMET.

Two regimes, and the boundary is the BLE scan starting:

```
t=20..55  elapsed=3870..3982ms  free~18000  lfb=13824->13824   (radio off)
t=56+     elapsed=36..89ms      free~14000  lfb=11264->...->5888  (radio on)
```

The boundary is not a coincidence. `post_task_loop()` primes before it scans: it retries the delivery POST and only calls `start_scan()` once one succeeds or the priming loop gives up. Under TLS it never succeeds, so the radio stays off for the first 40 s. Those first eight attempts run in the best heap conditions the device will ever have — 13824 bytes contiguous, nothing buffered — and they still fail.

## The timeout is not a slow handshake

Raising `cfg.timeout_ms` from 3000 to 15000 did not help. Every attempt then burned the full 15.9 s and failed identically, with 11264 to 15872 contiguous and the largest block unchanged across the call.

A capture on the server explains why. In 75 s the board opened **25 TCP connections** to the TLS port against **3** POST attempts, and the ones belonging to the POST client look like this:

```
10.84.x.x.59690 > server.4430: Flags [S]      length 0
server.4430 > 10.84.x.x.59690: Flags [S.]     length 0
10.84.x.x.59690 > server.4430: Flags [.]      length 0
10.84.x.x.59690 > server.4430: Flags [F.]     length 0     <- 32 ms after the ACK
```

TCP opens, and the board sends FIN 32 ms later without a ClientHello. TLS never starts on the wire. So `esp_http_client_perform()` is looping: socket, connect, `create_ssl_handle` fails, close, retry — about eight times per call — and `Failed to open new connection in specified timeout` is only the loop giving up. `mbedtls_ssl_setup returned -0x7F00` (`MBEDTLS_ERR_SSL_ALLOC_FAILED`) is the same failure caught on an iteration that logged it. One cause, two appearances.

That also explains why the longer timeout made the run worse rather than better: it buys more retry iterations, each of which claims and releases the same large buffers.

## Where the memory actually goes

The heartbeat sampled free heap at **880 bytes** and largest block at **112** during a run whose `perform()` probes reported 18612 free on either side of the call. The peak demand of a single connection attempt swings the whole heap, and the region dump shows there is nothing else to draw on — six of seven regions are full to within 532 bytes, and every free byte lives in one 113840-byte region:

```
At 0x3ffb2730 len 15448  free 36    largest_free_block 12
At 0x3ffaff10 len 240    free 4     largest_free_block 0
At 0x3ffb6388 len 7288   free 4     largest_free_block 0
At 0x3ffe0440 len 15072  free 80    largest_free_block 72
At 0x3ffb9a20 len 16648  free 56    largest_free_block 48
At 0x3ffccb88 len 78968  free 532   largest_free_block 200
At 0x3ffe4350 len 113840 free 18492 largest_free_block 13824  min_free 1552
```

So the reading in the issue body is right in substance and wrong in detail. It is not that the second session's buffers do not fit — 13824 is more than the 9818 the pair wants. It is that the whole attempt, CA parse included, peaks above what the one non-full region holds, and there is no second region to spill into.

## What this rules out

Not a slow handshake, not the 3 s timeout, not the server, which handshakes in 11 ms and answers. Not the record buffer sizes on their own: 8192/1024 is already the floor the delta stream tolerates and it does not clear it.

## What would be worth trying next

Reducing the *peak* rather than the steady state. The CA is parsed on every attempt; parsing it once and holding the chain would take an RSA-4096 key context and a DER copy out of the peak. Failing that, the options in the issue body stand, and sharing one session is the only one that removes the second peak entirely.

Runs and instrumentation on `spike/tls-failure-instrumentation`. The board is back on stock `main` firmware over plaintext: `post_ok=15`, `gw_dropped=0`.

**Comment by mairas** [comment]
Tried parsing the CA once. It removes the failure it targeted and does not make TLS work, for a reason worth recording.

`ensure_post_client()` now calls `esp_tls_set_global_ca_store()` and sets `cfg.use_global_ca_store` instead of handing `cfg.cert_pem` to every client, so the pinned CA is parsed once rather than inside each connection attempt.

The targeted failure is gone. Comparing error signatures across two 130 s runs of the same configuration:

| | `mbedtls_ssl_setup returned -0x7F00` |
|---|---|
| `cfg.cert_pem`, parsed per attempt | 126 |
| global CA store | 0 |

So the diagnosis in the previous comment holds: the CA parse was a real part of the attempt's peak, and taking it out is enough for `mbedtls_ssl_setup` to get its buffers.

What replaces it is a lifetime problem. The failures become `No server verification option set in esp_tls_cfg_t structure`, which means the store is gone by the time the next client uses it. `destroy_post_client()` runs on every failed attempt — deliberately, because a kept-alive handle whose socket has died stays dead — and esp-tls releases the global store with the client that referenced it. Re-setting the store on each rebuild, which is the other variant on the spike branch, keeps it working while there is memory to parse into and returns `ESP_FAIL` when there is not: 5 `ESP_OK` and 4 `ESP_FAIL` alternating in one run, with `ssl_setup` failures down to 2. That is the parse cost back in the attempt, just moved.

So this lever needs a store whose lifetime is not tied to a client that is destroyed on every failure — parsed once at startup, before the heap fragments, and never released. Whether esp-tls permits that with `esp_http_client` is the next thing to establish.

Separately, and worth flagging because it contaminated tonight's later runs: the device is not reliably stable in this configuration. Two of the runs had the **delta socket** fail its own handshake with `select() timeout` and never recover, leaving free heap at 6552 before the gateway attempted anything, and one run rebooted twice inside the first 8 s. Those runs measure the device's instability, not the change under test. Anything further here needs a stable baseline first.

Spike branch: `spike/tls-global-ca-store`. Board restored to stock `main` firmware over plaintext, `post_ok=14`, `gw_dropped=0`.
